{
  "version": "1.0",
  "surviving": [],
  "regenerated": [
    {
      "anchors": [
        "task:identifyApplicant",
        "unit:identity"
      ],
      "nodePath": "/tree",
      "code": "COMP-REGENERATION-REGENERATED",
      "severity": "info",
      "reason": "Clean generated node matched old and designer."
    }
  ],
  "orphaned": [],
  "pendingReview": [],
  "conflicts": [
    {
      "anchors": [
        "item:applicantName",
        "task:identifyApplicant",
        "unit:identity"
      ],
      "nodePath": "/tree/children/0",
      "code": "COMP-REGENERATION-PROPERTY-CONFLICT",
      "severity": "warning",
      "reason": "Designer and generator changed /placeholder differently.",
      "propertyDeltas": [
        "/placeholder"
      ]
    }
  ]
}
